Book,Chapter,Verse,Content
LUK,6,21,"Блаженні голодні тепер, бо насититесь. Блаженні плачущі тепер, бо сьміяти метесь."
LUK,6,22,"Блаженні, коли ненавидіти муть вас люде, й коли проженуть вас, і осоромлять, і викинуть імя ваше, як зло, задля Сина чоловічого."
LUK,6,23,"Радуйтесь того дня і веселітесь, ось бо нагорода ваша велика на небі; так бо чинили пророкам батьки їх."
LUK,6,24,"Горе ж вам, багатим! бо прийняли ви утіху вашу."
LUK,6,25,"Горе вам, ситим! бо голодувати мете. Горе вам, що сьмієтесь тепер; бо сумувати мете да плакати мете."
LUK,6,26,"Горе вам, коли добре говорити муть про вас усі люде; так бо робили лжепророкам батьки їх."
LUK,6,27,"Тільки ж глаголю вам, слухаючим: Любіть ворогів ваших, добре робіть ненавидникам вашим,"
LUK,6,28,"благословляйте кленучих вас, і моліть ся за обидників ваших."
LUK,6,29,"Хто бє тебе у щоку, підстав і другу; а хто бере твою свиту, й жупанка не борони."
LUK,6,30,"Всякому, хто просить у тебе, дай, і хто бере що твоє, не допевняй ся."
LUK,6,31,"І, як хочете, щоб чинили вам люде, так і ви чиніть їм."
LUK,6,32,"І коли любите тих, хто любить вас, яка вам дяка? бо й грішники тих, хто їх любить, люблять."
LUK,6,33,"І коли добро робите тим, хто добро робить вам, яка вам дяка? бо й грішники те саме чинять."
LUK,6,34,"І коли позичаєте тим, від кого маєте надію одержати, яка вам дяка? бо й грішники грішникам позичають, щоб одержати стільки ж."
LUK,6,35,"Ні, любіть ворогів ваших, і добро робіть, і позичайте, нічого від них не сподіваючись; а буде нагорода ваша велика, й будете синами Вишнього; бо Він благий до невдячних і лихих."
LUK,6,36,"Будьте ж оце милосерні, як і Отець ваш милосерден."
LUK,6,37,"І не судіть, то й не будете суджені; не осуджуйте, то й не будете осуджені; прощайте, то й буде вам прощено."
LUK,6,38,"Давайте, то й вам буде дано; міру добру, наталовану, й струснуту, й надто пересипану давати муть вам на лоно ваше. Такою бо мірою, якою міряєте, відміряєть ся вам."
LUK,6,39,"Чи може сліпий сліпого водити? хиба обидва в яму не впадуть?"
LUK,6,40,"Нема ученика над учителя свого; звершений же — буде кожен, як учитель його."
LUK,6,41,"Чого ж дивиш ся на порошину в оці брата твого, поліна ж у своєму оці не чуєш?"
LUK,6,42,"І як можеш казати братові твоєму: Брате, дай вийму порошину, що в оці твоїм, сам в оці своїм поліна не бачивши? Лицеміре, викинь перше ломаку з ока твого, а тоді бачити меш вийняти порошину з ока брата твого."
LUK,6,43,"Нема бо дерева доброго, що родить овощ пустий; ані дерева пустого, що родить овощ добрий."
LUK,6,44,"Кожне бо дерево по свому овощу пізнаєть ся; не збирають бо з тернини смокви, ані збирають з ожини винограду."
LUK,6,45,"Добрий чоловік з доброго скарбу серця свого виносить добре; а лихий чоловік з лихого скарбу серця свого виносить лихе: бо з переповні серця промовляють уста його."
LUK,6,46,"На що ж мене звете Господи, Господи, й не робите, що я глаголю?"
LUK,6,47,"Всякий, хто приходить до мене, й слухає слова мої, та й чинить їх, покажу вам, кому він подобен:"
LUK,6,48,"подобен він чоловікові, будуючому будинок, що викопав глибоко, й положив підвалину на камені; як же повідь настала, наперла бистрінь на будинок той, та не змогла схитнути його: збудовано бо його на камені."
LUK,6,49,"Хто ж слухає, та не чинить, подобен чоловікові, будуючому будинок на землі, без підвалини, на котрий наперла бистрінь, і зараз упав, і була руїна будинка того велика."
LUK,7,9,"Глаголю вам: Навіть в Ізраїлі, такої віри не знайшов я."
LUK,7,13,"Не плач."
LUK,7,14,"Молодче, тобі глаголю: встань."
LUK,7,22,"Ідіть сповістіть Йоана, що бачили й чули: як сліпі прозирають, криві ходять, прокаженні очищають ся, глухі чують, мертві встають, і вбогі благовіствують."
LUK,7,23,"І блажен, хто не зблазнить ся мною."
LUK,7,24,"Чого виходили ви дивитись у пустиню? На тростину, що вітер колише?"
LUK,7,25,"Або чого ж виходили ви дивитись? На чоловіка, в мягку одежу одягненого? Ось ті, що в одежі пишній та роскоші, панують у царських дворах."
LUK,7,26,"Або чого виходили ви дивитись: На пророка? Так, глаголю вам, і більш пророка."
LUK,7,27,"Се той, про кого написано: Ось я посилаю ангела мого перед лицем Твоїм, що приготовить дорогу Твою перед Тобою."
LUK,7,28,"Глаголю бо вам: Більшого між нарожденими від жінок пророка над Йоана Хрестителя нема; найменший же у царстві Божім більший від него."
LUK,7,31,"Кому ж оце уподоблю людей роду сього? й кому подобні вони?"
LUK,7,32,"Подобні вони дітям, що сидять на торгу та гукають одно на одного, та й кажуть: Ми сурмили вам, а ви не скакали; ми голосили вам, а ви не плакали."
LUK,7,33,"Прийшов бо Йоан Хреститель, що хліба не їсть, ані вина не пє, і кажете: Диявола має."
LUK,7,34,"Прийшов Син чоловічий, що їсть і пє, і кажете: Ось чоловік прожора та пяниця, митникам друг і грішникам."
LUK,7,35,"І оправдилась премудрість від дітей своїх усіх."
LUK,7,40,"Симоне, маю тобі щось сказати."
LUK,7,41,"Два довжники були в одного вірителя: один завинив пятьсот денариїв, другий же пятьдесять."
LUK,7,42,"Як же не мали чим оддавати, обом простив він. Хто ж оце з них, скажи, більш його любити ме?"
LUK,7,43,"Право судив єси."
LUK,7,44,"Чи бачиш ти сю жінку? Увійшов я в твою господу, — води на ноги мої не дав єси; ся ж слізми обмила ноги мої, і волоссєм голови своєї обтерла."
LUK,7,45,"Цілування не дав єси мені; ся ж, відколи ввійшов я, не перестала цілувати ноги мої."
LUK,7,46,"Оливою голови моєї не намастив єси; ся ж миром намастила ноги мої."
LUK,7,47,"Тим глаголю тобі: Оставляють ся гріхи її многі, бо возлюбила много; кому ж мало оставляєть ся, мало любить."
LUK,7,48,"Оставляють ся гріхи твої."
LUK,7,50,"Віра твоя спасла тебе; йди з упокоєм."
LUK,8,5,"Вийшов сіяч сіяти насіннє своє; і, як він сіяв, инше впало край шляху; й попритоптувано його, й птаство небесне пожерло його."
LUK,8,6,"А инше впало на камінь; і посходивши, посохло, бо не мало вогкости."
LUK,8,7,"А инше впало між тернину; й розвившись тернина з ним, поглушила його."
LUK,8,8,"А инше впало на землю добру, й, зійшовши, дало овощ у сотеро."
LUK,8,8,"Хто має уші слухати, нехай слухає."
LUK,8,10,"Вам дано знати тайни царства Божого, другим же в приповістях, щоб дивлячись не бачили, й слухаючи не розуміли."
LUK,8,11,"Єсть же ся приповість: Насіннє, се слово Боже."
LUK,8,12,"Ті, що край шляху, се, що слухають; опісля ж приходить диявол, та й забирає слово з серця їх, щоб віруючи не спасли ся."
LUK,8,13,"Що ж на камені, се, що, вислухавши, з радістю приймають слово, та сі кореня не мають; до часу вірують, а під час спокуси відпадають."
LUK,8,14,"Що ж між тернину впало, се, ті, що вислухавши, відходять, і журбою, та багацтвом, та роскошами життя поглушені, не дають овощу."
LUK,8,15,"Що ж у добрій землі, се ті, що, вислухавши слово, в серці щирому й доброму держять, і дають овощ у терпінню."
LUK,8,16,"Ніхто ж, засьвітивши сьвічку, не покрива її посудиною, або під ліжко її ставить; тільки ж на сьвічнику ставлять, щоб входячі бачили сьвітло."
LUK,8,17,"Нема бо нічого тайного, що не виявить ся, і нічого втаєного, що не взнаєть ся і на яв не вийде."
LUK,8,18,"Вважайте оце, як слухаєте: хто бо має, дасть ся тому; а хто не має, і що, здаєть ся, має, візьметь ся від него."
LUK,8,21,"Мати моя та брати мої ті, хто слово Боже слухає і чинить його."
LUK,8,22,"Попливемо на той бік озера."
LUK,8,25,"Де ж віра ваша?"
LUK,8,30,"Яке тобі імя?"
LUK,8,39,"Вернись до дому твого та розкажи, скільки зробив тобі Господь."
LUK,8,45,"Хто приторкнув ся до мене?"
LUK,8,45,"Хто приторкнувсь до мене?"
LUK,8,46,"Приторкнув ся до мене хтось; я бо чув, що сила вийшла з мене."
LUK,8,48,"Бодрись, дочко: віра твоя спасла тебе; йди з упокоєм."
LUK,8,50,"Не бій ся; тільки віруй, то й спасеть ся."
LUK,8,52,"Не плачте; не вмерла, а спить."
LUK,8,54,"Дівчинко, встань."
LUK,9,3,"Нічого не беріть на дорогу, ні палиці, ні торбини, ні хліба, ні срібла, ані по дві одежині майте."
LUK,9,4,"І в котору господу прийдете, там пробувайте й звідтіля виходьте."
LUK,9,5,"А хто не прийме вас, виходячи з города того, й порох з ваших ніг обтрусіть на сьвідкуваннє проти них."
LUK,9,13,"Дайте ви їм їсти."
LUK,9,14,"Садовіть їх купами по пятьдесятеро."
LUK,9,18,"Хто я, каже народ?"
LUK,9,20,"Ви ж, хто я, кажете?"
LUK,9,22,"Що мусить Син чоловічий багато терпіти, й відцурають ся Його старші, та архиєреї, та письменники, і вбють, і в третій день воскресне Він."
LUK,9,23,"Коли хто хоче за мною йти, нехай одречеть ся себе, й бере хрест свій що-дня, та й іде слідом за мною."
LUK,9,24,"Хто бо хоче душу свою спасти, погубить її; хто ж погубить душу свою задля мене, той спасе її."
LUK,9,25,"Що бо за користь мати ме чоловік, здобувши сьвіт увесь, себе ж погубивши або занапастивши?"
LUK,9,26,"Хто бо посоромить ся мене й моїх словес, того й Син чоловічий посоромить ся, як прийде в славі своїй, і Отця, і сьвятих ангелів."
LUK,9,27,"Глаголю ж вам істино: Єсть деякі між стоячими тут, що не вкусять смерті, аж поки побачять царство Боже."
LUK,9,41,"О кодло невірне та розвратне! доки буду з вами й терпіти му вас? Приведи сюди сина твого."
LUK,9,44,"Повкладуйте в уші ваші слова сі: Син бо чоловічий має бути виданим у руки чоловічі."
LUK,9,48,"Хто прийме сю дитину в імя моє, мене приймає; а хто мене прийме, приймає пославшого мене: хто бо найменший між усіма вами, той буде великий."
LUK,9,50,"Не бороніть, хто бо не проти нас, той з нами."
LUK,9,55,"Не знаєте, якого ви духа."
LUK,9,56,"Син бо чоловічий не прийшов душі людські погубляти, а спасати."
LUK,9,58,"Лисиці нори мають, і птиці небесні гнізда; Син же чоловічий не має, де голови прихилити."
LUK,9,59,"Йди слідом за мною."
LUK,9,60,"Остав мертвим ховати своїх мерців, ти ж іди, проповідуй царство Боже."
LUK,9,62,"Ніхто, положивши руку свою на рало й позираючи назад, не спосібен до царства Божого."
LUK,10,2,"Жниво велике, робітника ж мало: просіть же Господа жнива, щоб випровадив робітників на жниво своє."
LUK,10,3,"Ійдіть; ось я посилаю вас, як ягнят між вовки."
LUK,10,4,"Не носіть калитки, ні торбини, ні обувя, і нікого в дорозї не витайте."
LUK,10,5,"У котру ж господу ввійдете, перше кажіть: Впокій домові сьому;"
LUK,10,6,"і коли там буде син упокою, спочине на йому впокій ваш; коли ж ні, до вас вернеть ся."
LUK,10,7,"У тім же дому зоставайтесь, ївши й пивши, що є в них: достоєн бо робітник нагороди своєї. Не ходіть від хати до хати."
LUK,10,8,"І в которий город увійдете, й приймуть вас, їжте що поставлять перед вами,"
LUK,10,9,"і сціляйте в ньому недужих, і кажіть їм: Наближилось до вас царство Боже."
LUK,10,10,"У которий же город прийдете й не приймуть вас, вийшовши на улиці його, скажіть:"
LUK,10,11,"І порох, що поприлипав до нас із города вашого, обтрушуємо вам; тільки ж се знайте, що наближилось до вас царство Боже."
LUK,10,12,"Глаголю ж вам, що Содомлянам дня того одрадніщ буде, ніж городові тому."
LUK,10,13,"Горе тобі, Хоразине! горе тобі, Витсаїдо! бо коли б у Тирі та Сидоні стались чудеса, що стали ся в вас, давно б, у веретищі та в попелі сидячи, покаялись."
LUK,10,14,"Тільки ж Тирові й Сидонові одрадніщ буде на суді, ніж вам."
LUK,10,15,"І ти, Капернауме, що аж до неба підняв ся, аж у пекло провалиш ся."
LUK,10,16,"Хто слухає вас, мене слухає; а хто гордує вами, мною гордує; хто ж мною гордує, гордує Пославшим мене."
LUK,10,18,"Видів я сатану, як блискавку з неба падаючого."
LUK,10,19,"Ось даю вам силу наступати на гадюки й на скорпиони, й на всю силу ворожу, й ніщо вам не шкодити ме."
LUK,10,20,"Тільки ж бо сим не втішайтесь, що духи вам корять ся; втішайте ся ж більш, що імена ваші написані на небесах."
LUK,10,21,"Дякую Тобі, Отче, Господи неба й землі, що втаїв се від премудрих і розумних, а відкрив недоліткам. Так, Отче: бо так воно вподобалось перед Тобою."
LUK,10,22,"Усе передане мені від Отця; і ніхто не знає, хто Син, тільки Отець, і хто Отець, тільки Син та кому схоче Син одкрити."
LUK,10,23,"Блаженні очі, котрі бачять, що ви бачите:"
LUK,10,24,"глаголю бо вам: Що многі пророки й царі хотіли бачити, що ви бачите, та й не бачили, й чути, що ви чуєте, та й не чули."
LUK,10,26,"В законі що написано? як читаєш?"
LUK,10,28,"Право відказав єси. Се чини, то й жити меш."
LUK,10,30,"Чоловік один ійшов з Єрусалиму в Єрихон, і попав ся розбійникам, котрі, обдерши його й рани завдавши, пійшли, зоставивши півмертвого."
LUK,10,31,"Случаєм ійшов якийся священик дорогою тією, і, побачивши його, пройшов мимо."
LUK,10,32,"Так само ж і левит, лучившись на те місце, приступивши й подивившись, пройшов мимо."
LUK,10,33,"Самарянин же один, ідучи дорогою, прийшов до него й, побачивши його, милосердував ся,"
LUK,10,34,"і, приступивши, обвязав рани його, ллючи оливу та вино, й, посадивши його на свою скотину, привів його в гостинницю, і пильнував його;"
LUK,10,35,"а назавтра, одходячи, вийняв два денариї, дав гостинникові, та й каже йому: Доглядай його, і що над се видаси, я, вернувшись, оддам тобі."
LUK,10,36,"Хто ж оце з тих трох здаєть ся тобі ближнім тому, що попавсь між розбійники?"
LUK,10,37,"Іди й ти чини так."
LUK,10,41,"Марто, Марто, журиш ся та побиваєш ся про многе,"
LUK,10,42,"одного ж треба. Мария добру частину вибрала, що не відніметь ся від неї."
LUK,11,2,"Коли молитесь, кажіть: Отче наш, що на небесах! Нехай святить ся імя Твоє, нехай прийде царство Твоє, нехай буде воля Твоя, як на небі, так і на землі."
LUK,11,3,"Хліб наш щоденний дай нам сьогодні."
LUK,11,4,"І прости нам довги наші, як і ми прощаємо кожному довжникові нашому; й не введи нас у спокусу, а ізбави нас від лукавого."
LUK,11,5,"Хто з вас мати ме приятеля, і прийде до него о півночі, і скаже йому: Друже, позич мені три хліби,"
LUK,11,6,"бо приятель мій прийшов до мене з дороги, й не маю що поставити перед ним;"
LUK,11,7,"а той із середини, озвавшись, скаже: Не турбуй мене; вже двері зачинені, і діти мої зо мною в постелі; не можу, вставши, дати тобі:"
LUK,11,8,"глаголю вам: Хоч і не дасть йому, вставши, що він йому друг, та задля докучання його, вставши, дасть йому, скільки йому треба."
LUK,11,9,"І я вам глаголю: Просіть, то й дасть ся вам; шукайте, то й знайдете; стукайте, то й одчинить ся вам."
LUK,11,10,"Кожен бо, хто просить, одержує; і хто шукає, знаходить; і хто стукає, тому відчиняють."
LUK,11,11,"У которого ж з вас, батьків, просити ме син хліба, чи каменя подасть йому? а як риби, чи замість риби гадюку подасть йому?"
LUK,11,12,"Або коли просити ме яйця, чи подасть йому скорпиона?"
LUK,11,13,"Коли ж ви, лихими бувши, знаєте добрі дари давати дітям вашим, як же більш Отець із неба, не дасть Духа сьвятого тим, що просять у Него?"
LUK,11,17,"Кожне царство, проти себе розділившись, пустіє; і господа — проти господи, падає."
LUK,11,18,"Коли ж і сатана проти себе розділить ся, як устоїть царство його? Бо кажете, що Вельзевулом виганяю біси."
LUK,11,19,"Коли ж я Вельзевулом виганяю біси, то сини ваші ким виганяють їх? Тим суддями вашими вони будуть."
LUK,11,20,"Коли ж пальцем Божим виганяю біси, то конче пристигло до вас царство Боже."
LUK,11,21,"Коли ж сильний, вʼоружившись, стереже свого двору, то в спокою добро його."
LUK,11,22,"Коли ж сильніщий над него, прийшовши, подужає його, то всю зброю його бере, що на неї вповав, та й роздає здобич його."
LUK,11,23,"Хто не зо мною, той проти мене; і хто не збирає зо мною, розсипає."
LUK,11,24,"Як же нечистий дух вийде з чоловіка, то блукає по безвіддях, шукаючи впокою, і, не знайшовши, каже: Вернусь до домівки моєї, звідкіля вийшов."
LUK,11,25,"І прийшовши знайде її виметену й прибрану."
LUK,11,26,"Тоді йде та бере сім инших духів, зліщих над себе; і, ввійшовши, домують там; і буде останнє чоловіка того гірше першого."
