Book,Chapter,Verse,Content
MAT,3,15,"Допусти тепер, бо так годить ся нам чинити всяку правду."
MAT,4,4,"Писано: Не самим хлібом жити ме чоловік, а кожним словом, що виходить із уст Божих."
MAT,4,7,"Писано знов: Не спокушуй Господа Бога твого."
MAT,4,10,"Геть від мене, сатано! писано бо: Господу Богу твоєму кланяти меш ся, і Йому одному служити меш."
MAT,4,17,"Покайтесь, наближилось бо царство небесне."
MAT,4,19,"Ідіть за мною, то зроблю вас ловцями людськими."
MAT,5,3,"Блаженні вбогі духом, бо їх царство небесне."
MAT,5,4,"Блаженні сумні, бо такі втішять ся."
MAT,5,5,"Блаженні тихі, бо такі осягнуть землю."
MAT,5,6,"Блаженні голодні й жадні правди, бо такі наситять ся."
MAT,5,7,"Блаженні милостиві, бо такі будуть помилувані."
MAT,5,8,"Блаженні чисті серцем, бо такі побачять Бога."
MAT,5,9,"Блаженні миротворці, бо такі синами Божими звати муть ся."
MAT,5,10,"Блаженні, кого гонять за правду, бо їх царство небесне."
MAT,5,11,"Блаженні ви, коли вас безчестити муть, та гонити муть, та казати муть на вас усяке лихе слово не по правді, ради мене."
MAT,5,12,"Радуйтесь і веселітесь: бо велика нагорода ваша на небі; так бо гонили й пророків, що бували перше вас."
MAT,5,13,"Ви сіль землі; коли ж сіль звітріє, то чим солити? Ні-на-що не годить ся тоді вона, тільки щоб викинути геть і щоб топтали її люде."
MAT,5,14,"Ви сьвітло сьвіту. Не може город сховати ся, стоячи на горі;"
MAT,5,15,"і, засьвітивши сьвічку, не ставлять під посудину, а на сьвічнику; то й сьвітить вона всім, хто в хаті,"
MAT,5,16,"так нехай сяє сьвітло ваше перед людьми, щоб вони бачили ваші добрі діла, й прославляли Отця вашого, що на небі."
MAT,5,17,"Не думайте, що я прийшов знівечити закон або пророків; не прийшов я знівечити, а сповнити."
MAT,5,18,"Істино бо глаголю вам: Доки перейде небо й земля, одна йота, або одна титла не перейде з закону, аж поки все станеть ся."
MAT,5,19,"Тим, хто поламле одну найменшу з сих заповідей і навчить так людей, той звати меть ся найменшим у царстві небесному; а хто сповнить і навчить, той звати меть ся великим у царстві небесному."
MAT,5,20,"Глаголю бо вам: Що коли ваша правда не переважить письменників та Фарисеїв, то не ввійдете в царство небесне."
MAT,5,21,"Чували ви, що сказано старосьвіцьким: Не вбий, а хто вбє, на того буде суд."
MAT,5,22,"Я ж вам глаголю: Хто сердить ся на брата свого без причини, на того буде суд; а хто скаже на брата свого: Рака, на того буде громадський суд; хто ж скаже: дурню, на того буде огонь пекольний."
MAT,5,23,"Тим, коли принесеш дар свій до жертівні, й згадаєш там, що твій брат має що проти тебе;"
MAT,5,24,"зостав свій дар перед жертівнею, і йди геть, помирись перш із братом твоїм, а тоді прийди й подай дар твій."
MAT,5,25,"Мирись із твоїм противником хутко, доки ти ще в дорозї з ним, щоб не віддав тебе противник судді, а суддя не віддав тебе осавулі (слузї), і не вкинуто тебе в темницю."
MAT,5,26,"Істино глаголю тобі: Не вийдеш звідтіля, доки не віддаси й останнього шеляга."
MAT,5,27,"Чували ви, що сказано старосьвіцьким: Не чини перелюбу."
MAT,5,28,"Я ж вам глаголю: Хто спогляне на жінку жадібним оком, той уже вчинив перелюб із нею в серці своїм."
MAT,5,29,"Коли ж око твоє праве блазнить тебе, вирви його, й кинь від себе; бо більша користь тобі, щоб один із членів твоїх згинув, а не все тіло вкинуто в пекло."
MAT,5,30,"І коли права рука твоя блазнить тебе, відотни її, й кинь від себе; більша бо користь тобі, щоб один із членів твоїх згинув, а не все тіло твоє вкинуто в пекло."
MAT,5,31,"Сказано ж: Що хто розводить ся з жінкою своєю, нехай дасть їй розвідний лист."
MAT,5,32,"Я ж вам глаголю: Що хто розведеть ся з жінкою своєю, хиба що за перелюб, доводить її до перелюбу; й хто оженить ся з розвідкою, чинить перелюб."
MAT,5,33,"Знов чували, що сказано старосьвіцьким: Не кленись криво, а сповняй перед Господом обітниці твої."
MAT,5,34,"Я ж вам глаголю: Не кляніть ся зовсім: ні небом, бо воно престол Божий;"
MAT,5,35,"ні землею, бо вона підніжок ніг Його; ні Єрусалимом, бо се город великого царя;"
MAT,5,36,"ні головою твоєю не клянись, бо не зможеш зробити ні одного волоса білим або чорним."
MAT,5,37,"Слово ж ваше нехай буде: так, так; ні, ні; бо що більш над се, те від лихого."
MAT,5,38,"Чували ви, що сказано: Око за око, й зуб за зуб."
MAT,5,39,"Я ж вам глаголю: Не противтесь лихому, а хто вдарить тебе у праву щоку твою, повернись до него й другою."
MAT,5,40,"І хто схоче судитись із тобою і зняти з тебе свиту, віддай йому й жупанок."
MAT,5,41,"І хто силувати ме тебе йти милю, йди з ним дві."
MAT,5,42,"Дай, хто в тебе просить, і хто хоче в тебе позичити, не одвертайсь від него."
MAT,5,43,"Чували ви, що сказано: Люби ближнього твого, й ненавидь ворога твого."
MAT,5,44,"Я ж вам глаголю: Любіть ворогів ваших, благословляйте, хто клене вас, робіть добро, хто ненавидить вас, і моліть ся за тих, що обижають вас і гонять вас;"
MAT,5,45,"щоб вам бути синами Отця вашого, що на небі; Він бо велить сонцю своєму сходити над лихими й над добрими, й посилає дощ на праведних і неправедних."
MAT,5,46,"Бо коли ви любите тих, що люблять вас, то за що вам нагорода? хиба й митники не те саме роблять?"
MAT,5,47,"І коли витаєте тільки братів ваших, то що надто робите? хиба й митники не так роблять?"
MAT,5,48,"Оце ж бувайте звершені, як Отець ваш, що на небі, звершений."
MAT,6,1,"Остерегайтесь подавати милостиню вашу перед людьми, щоб вони вас бачили; а то не мати мете ніякої нагороди від Отця вашого, що на небі."
MAT,6,2,"Тим, коли подаєш милостиню, то не труби в трубу перед собою, як роблять лицеміри по школах та по улицях, щоб здобути слави в людей. Істино глаголю вам: Мають вони нагороду собі."
MAT,6,3,"Ти ж, як подаєш милостиню, то нехай ліва рука твоя не знає, що робить права:"
MAT,6,4,"щоб твоя милостиня була потайна; а Отець твій, що бачить потайне, віддасть тобі прилюдно."
MAT,6,5,"І коли молиш ся, не будь таким, як лицеміри; бо вони люблять молитись, стоячи в школах та по росхідних улицях, щоб їх бачили люде. Істино глаголю вам: Мають вони нагороду собі."
MAT,6,6,"Ти ж, коли молиш ся, увійди в хатину твою та, зачинивши двері, помолись Отцю твоєму потай; а Отець твій, що бачить потайне, віддасть тобі прилюдно."
MAT,6,7,"Як же молитесь, то не говоріть багато, як погане: бо вони думають, що за довгі молитви будуть вислухані."
MAT,6,8,"Не приподоблюйте ся ж до них; бо Отець ваш знає, чого вам треба, перш ніж просите в Него."
MAT,6,9,"Тим же то моліться ось як: Отче наш, що на небі! Нехай святить ся імя твоє."
MAT,6,10,"Нехай прийде царство твоє. Нехай буде воля твоя, як на небі, так і на землі."
MAT,6,11,"Хліб наш щоденний дай нам сьогодні."
MAT,6,12,"І прости нам довги наші, як і ми прощаємо довжникам нашим."
MAT,6,13,"І не введи нас у спокусу, а ізбави нас від лукавого. Бо твоє єсть царство й сила, й слава по віки. Амінь."
MAT,6,14,"Бо коли прощати мете людям провини їх, то й Отець ваш небесний прощати ме вам."
MAT,6,15,"Як же не прощати мете людям провин їх, то й Отець ваш небесний не прощати буде провин ваших."
MAT,6,16,"Коли ж постите, нехай не буде в вас, як у лицемірів, сумного виду: зміняють бо лиця свої, щоб здаватись людям постниками. Істинно глаголю вам: Що мають вони нагороду собі."
MAT,6,17,"Ти ж, коли постиш, намасти голову твою, і вмий лице твоє;"
MAT,6,18,"щоб не здавав ся людям постником, а Отцеві твоєму, що потай; а Отець твій, що бачить потайне, віддасть тобі прилюдно."
MAT,6,19,"Не збирайте собі скарбів на землі, де міль і ржа їсть, і де злодії підкопують ся і крадуть."
MAT,6,20,"Збирайте ж собі скарби на небі, де ні міль, ні ржа не їсть, і де злодії не підкопують ся й не крадуть."
MAT,6,21,"Бо де скарб ваш, там буде й серце ваше."
MAT,6,22,"Сьвітло тілу око; тим, коли око в тебе ясне, то й все тіло твоє буде сьвітле."
MAT,6,23,"Коли ж у тебе око лихе, то й все тіло твоє буде темне. Тим, коли сьвітло, що в тобі, буде темрява, то яка велика се темрява!"
MAT,6,24,"Ніхто не може служити двом панам, бо, або одного ненавидіти ме, а другого любити ме; або до одного прихилить ся, а другим гордувати ме. Не можете Богу служити й мамоні."
MAT,6,25,"Тим глаголю вам: Не журіть ся життєм вашим, що вам їсти або пити; ані тілом вашим, чим зодягти ся. Чи душа ж не більше їжі, а тіло одежі?"
MAT,6,26,"Спогляньте на птаство небесне, що не сіють і не жнуть, ані збирають у клуню; от же Отець ваш небесний годує їх. А ви хиба не луччі від них?"
MAT,6,27,"Хто з вас, журячись, може прибавити собі зросту хоч на один локіть?"
MAT,6,28,"І одежею чого вам журитись? Придивіть ся до польових лилій, як вони ростуть; не працюють, ні прядуть;"
MAT,6,29,"глаголю ж вам: Що й Соломон у всій славі своїй не одягавсь так, як одна з них."
MAT,6,30,"Коли ж Бог так зʼодягає польове зіллє, що сьогодні воно є, а завтра вкинуть його в піч, то чи не більше ж зʼодягати ме вас, маловірні?"
MAT,6,31,"Тим же то не журіть ся, кажучи: Що їсти мем? або: Що пити мем? або: Чим зодягнемось?"
MAT,6,32,"Про все таке побивають ся погане; бо Отець ваш небесний знає, що вам усього того треба."
MAT,6,33,"А шукайте перш царства Божого та правди Його; се ж усе додасть ся вам."
MAT,6,34,"Оце ж не журіть ся про завтра; бо завтра журити меть ся само про своє. Доволі в кожного дня лиха свого."
MAT,7,1,"Не судіть, щоб вас не суджено."
MAT,7,2,"Бо яким судом судите, вас судити муть; і якою мірою міряєте, вам одміряєть ся."
MAT,7,3,"Чого ж дивиш ся на порошину в оці брата твого, у своєму ж оці поліна не чуєш?"
MAT,7,4,"Або, як скажеш ти братові твоєму: Дай я вийму порошину тобі з ока, а он у тебе самого поліно в оці?"
MAT,7,5,"Лицеміре, перш вийми в себе самого з ока ломаку; тоді добре бачити меш, як вийняти братові твоєму з ока порошину."
MAT,7,6,"Не давайте сьвятого собакам, і не кидайте ваших перел перед свинями, щоб не потоптали їх ногами своїми й, обернувшись, не порвали вас."
MAT,7,7,"Просіть, то й дасть ся вам; шукайте, то й знайдете; стукайте, то й відчинить ся вам:"
MAT,7,8,"кожен бо, хто просить, одержує; і хто шукає, знаходить; і хто стукає, тому відчиняють."
MAT,7,9,"Або, чи є між вами така людина, що в неї син попросить хліба, а вона подала б йому каменя?"
MAT,7,10,"або коли попросить риби, а вона подала б йому гадюку?"
MAT,7,11,"Коли ж ви, бувши лихими, умієте давати добрі дари дітям вашим, то чи не більше ж давати ме все добре Отець ваш, що на небі, тим, хто просить у Него?"
MAT,7,12,"Оце ж, усе, що бажаєте, щоб робили вам люде, так і ви робіть їм; се бо єсть закон і пророки."
MAT,7,13,"Увіходьте вузкими дверима, бо широкі ті двері й розлога та дорога, що веде до погибелі, й багацько таких, що ними входять:"
MAT,7,14,"вузкі бо ті двері, й тісна та дорога, що веде до життя, і мало таких, що їх знаходять."
MAT,7,15,"Остерегайтесь лжепророків, що приходять до вас ув одежі овечій, а в середині вони вовки хижі."
MAT,7,16,"Познаєте їх по овощам їх. Чи збирають виноград із тернини, або фиґи з бодяків?"
MAT,7,17,"Так усяке добре дерево родить овощ добрий, а пусте дерево родить овощ лихий."
MAT,7,18,"Не може добре дерево родити лихого овощу, ані пусте дерево родити овощу доброго."
MAT,7,19,"Усяке дерево, що не родить доброго овощу, рубають і кидають ув огонь."
MAT,7,20,"Оце ж по овощам їх познаєте їх."
MAT,7,21,"Не кожен, хто говорить до мене: Господи, Господи! увійде в царство небесне, а той, хто чинить волю Отця мого, що на небі."
MAT,7,22,"Многі казати муть до мене того дня: Господи, Господи, чи не в твоє ж імя ми пророкували? й не твоїм імям біси виганяли? й не твоїм імям великі чудеса робили?"
MAT,7,23,"І промовлю тоді до них: Ніколи я вас не знав; ійдіть від мене, ви, що чините беззаконнє."
MAT,7,24,"Оттим же, всякий, хто слухає сі слова мої й чинить їх, того уподоблю я чоловікові мудрому, що збудував свій будинок на камені;"
MAT,7,25,"і полили дощі, й надійшла повідь і забуяли вітри, й наперли на той будинок; та й не впав він; бо основано його на камені."
MAT,7,26,"А всякий, хто слухає сі слова мої, та й не чинить їх, уподобить ся чоловікові необачному, що збудував свій будинок на піску;"
MAT,7,27,"і полили дощі, й надійшла повідь, і забуяли вітри, й наперли на той будинок; і впав він, і велика була руїна його."
MAT,8,3,"Хочу, очистись"
MAT,8,4,"Гледи ж, не кажи нікому, а йди та покажись священикові, й принеси дар, який повелів Мойсей на сьвідкуваннє їм."
MAT,8,7,"Я пійду та сцілю його."
MAT,8,10,"Істино кажу вам: Навіть в Ізраїлі не знайшов я такої віри."
MAT,8,11,"І кажу вам: Що многі прийдуть від сходу й заходу, та й сядуть з Авраамом, з Ісааком і з Яковом у царстві небесному,"
MAT,8,12,"а сини царства будуть повикидані у темряву надвірню: там буде плач і скриготаннє зубів."
MAT,8,13,"Йди, і, як вірував єси, станеть ся тобі."
MAT,8,20,"Лисиці мають нори, й птаство небесне гнізда; Синові ж чоловічому ніде й голови прихилити."
MAT,8,22,"Йди слідом за мною; нехай мертві ховають мерці свої."
MAT,8,26,"Чого ви злякались, маловірні?"
MAT,8,32,"Ійдіть"
MAT,9,2,"Бодрись, сину; одпускають ся тобі гріхи твої."
MAT,9,4,"На що ви думаєте лукаве в серцях ваших?"
MAT,9,5,"Що ж бо легше: сказати: Одпускають ся тобі гріхи, чи сказати: Устань, та й ходи?"
MAT,9,6,"От же, щоб знали ви, що Син чоловічий має власть на землі прощати гріхи,"
MAT,9,6,"Устань, візьми постіль твою, та й іди до дому твого!"
MAT,9,9,"Йди слідом за мною."
MAT,9,12,"Дужим не треба лікаря, тільки недужим."
MAT,9,13,"От же йдіть та навчіть ся, що воно єсть: Милости хочу, а не жертви. Не прийшов бо я звати праведних а грішних до покаяння."
MAT,9,15,"Чи можуть весільні синове сумувати, поки з ними жених? Прийдуть же дні, що візьмуть від них жениха, тоді й постити муть."
MAT,9,16,"Ніхто не пришиває шматка нового сукна до старої одежини, бо відодреть ся його латка від одежини, й дірка буде гірша."
MAT,9,17,"І не наливають нового вина у старі міхи, ато міхи прорвуть ся, і вино витече, й міхи пропадуть; а наливають нове вино в міхи нові, то й буде все ціле."
MAT,9,22,"Дочко, бодрись; віра твоя спасла тебе."
MAT,9,24,"Уступіть ся: не вмерло бо дівча, а спить."
MAT,9,28,"Чи віруєте ви, що я можу се зробити?"
MAT,9,29,"По вірі вашій нехай станеть ся вам."
MAT,9,30,"Гледіть, щоб ніхто не довідавсь."
MAT,9,37,"Жнива багато, робітника ж мало."
MAT,9,38,"Просіть Господа жнива, щоб вислав женців на жниво своє."
MAT,10,5,"Не йдіть шляхом поган, і не ввіходьте в город Самарянський;"
MAT,10,6,"а радніщ ійдіть до загублених овечок дому Ізраїлевого;"
MAT,10,7,"а ходячи проповідуйте, глаголючи: Царство небесне наближилось."
MAT,10,8,"Сціляйте недужих, очищайте прокажених, воскрешайте мертвих, виганяйте біси; дармо прийняли, дармо й давайте."
MAT,10,9,"Не беріть собі ні золота, ні срібла, ні грошей у череси ваші,"
MAT,10,10,"ані торбини на дорогу, ані двох одежин, ні обувя, ні палиці: бо робітник достоєн харчі своєї."
MAT,10,11,"І в який город чи село ввійдете, роспитайте, хто там є достойний; там і пробувайте, аж поки вийдете."
MAT,10,12,"А як увійдете в яку господу, витайте її, кажучи: Мир сій господі."
MAT,10,13,"І, коли господа достойна, нехай упокій ваш зійде на неї. Коли ж вона недостойна, то нехай упокій ваш вернеть ся до вас."
MAT,10,14,"А хто вас не прийме й не слухати ме словес ваших, то, виходячи з такого дому чи города того, отрусіть і порох із ніг ваших."
MAT,10,15,"Істинно глаголю вам: Легше буде землі Содомській та Гоморській суднього дня, ніж городові тому."
MAT,10,16,"Оце я посилаю вас, як овечок між вовки; тим бувайте мудрі, як вужі, та тихі, як голуби."
MAT,10,17,"Та й стережіть ся людей: бо вони видавати муть вас у судові зборища, й в школах своїх бити вас будуть;"
