Book,Chapter,Verse,Content
LUK,20,37,"А що встають мертві, то й Мойсей показав коло купини, як зве Господа Богом Авраама, й Богом Ісаака, й Богом Якова."
LUK,20,38,"Бог же не мертвих, а живих, всі бо Йому живуть."
LUK,20,41,"Як се кажуть, що Христос син Давидів?"
LUK,20,42,"А сам Давид говорить у книзї псальм: Рече Господь Господеві моєму: Сиди по правиці в мене,"
LUK,20,43,"доки положу ворогів Твоїх підніжком ніг твоїх."
LUK,20,44,"Давид оце Господом Його зве: як же Він син Його?"
LUK,20,46,"Остерегайтесь письменників, що бажають ходити в шатах, та люблять витання на торгах, та перві сідалища по школах, та перві місця на бенкетах;"
LUK,20,47,"що жеруть доми вдовиць, і для виду довго молять ся. Сі приймуть ще тяжчий осуд."
LUK,21,3,"Правдиво глаголю вам, що вдовиця вбога ся більш усіх укинула:"
LUK,21,4,"всі бо ті з достатку свого кидали у дари Божі, ся ж з недостатку свого увесь прожиток свій, що мала, вкинула."
LUK,21,6,"Із сього, що бачите, прийдуть дні, в котрі не зоставить ся камінь на камені, щоб не зруйновано."
LUK,21,8,"Гледіть, щоб не були зведені; многі бо прийдуть в імя моє, кажучи: Що се я. А час приближив ся; не йдіть же за ними."
LUK,21,9,"Як же почуєте про войни та ворохобні, не полохайтесь; мусить бо перш се статись; тільки ж не зараз конець."
LUK,21,10,"Устане нарід на нарід і царство на царство,"
LUK,21,11,"і трус великий по місцях, і голоднеча, й помір буде, й страхи, й ознаки з неба великі будуть."
LUK,21,12,"Та перш того всього наложать на вас руки свої і гонити муть, видаючи в школи й темниці, і водячи перед царі та ігемони задля імя мого."
LUK,21,13,"І станеть ся воно вам на сьвідкуваннє."
LUK,21,14,"Постановіть же в серцях ваших наперед, не готовитись відказувати:"
LUK,21,15,"я бо дам вам уста й премудрість, котрій не здоліють противитись, ані встояти усі противники ваші."
LUK,21,16,"Будете ж видавані й від родителів, і братів, і родини, й приятелів: і вбивати муть деяких з вас."
LUK,21,17,"І будете ненавиджені від усіх задля імя мого."
LUK,21,18,"Та й волосина з голови вашої не загине."
LUK,21,19,"У терпінню вашому осягніть душі ваші."
LUK,21,20,"Як же побачите, що обгорнуто таборами Єрусалим, тоді знайте, що наближило ся спустіннє його."
LUK,21,21,"Тоді, хто в Юдеї, нехай біжять у гори; а хто в середині в йому, нехай виходять; а ті, що по селах, нехай не ввіходять у него."
LUK,21,22,"Бо се дні мести, щоб справдилось усе написане."
LUK,21,23,"Горе ж важким і годуючим у ті дні! буде бо біда велика на землі, і гнів на народі сьому."
LUK,21,24,"І поляжуть від гострого меча, й позаймані будуть у полонь до всіх поган; і топтати муть Єрусалим погане, доки сповнять ся часи поган."
LUK,21,25,"І будуть ознаки на сонці, й місяці, й зорях, а на землі переполох народів у заколоті; як зареве море та филі."
LUK,21,26,"І омертвіють люде від страху та дожидання того, що прийде на вселенну: сили бо небесні захитають ся."
LUK,21,27,"І тоді побачять Сина чоловічого, йдучого на хмарі з силою і славою великою."
LUK,21,28,"Як же зачне се діятись, випростуйтесь і підіймайте голови ваші; бо наближилось викупленнє ваше."
LUK,21,29,"Бачте смоківницю і всякі дерева:"
LUK,21,30,"Як розпукують ся вже, бачивши самі розумієте, що вже близько літо."
LUK,21,31,"Так і ви, коли побачите, як се станеть ся, знайте, що близько царство Боже."
LUK,21,32,"Істино глаголю вам: Ще не перейде рід сей, доки все станеть ся."
LUK,21,33,"Небо й земля перейде, слова ж мої не перейдуть."
LUK,21,34,"Остерегайте ся ж, щоб часом не обтягчились ваші серця прожорством, та пянством, та журбою життя сього, й щоб несподівано на вас не настиг день той."
LUK,21,35,"Бо, як сітка, впаде на всіх, що живуть на лиці всієї землі."
LUK,21,36,"Пильнуйте, по всяк час молячись, щоб удостоїли ся втекти від того всього, що має статись, і станути перед Сином чоловічим."
LUK,22,8,"Йдіть та приготовте нам пасху їсти."
LUK,22,10,"Ось, як увійдете в город, зустріне вас чоловік, глек води несучи. Йдіть слідом за ним у господу, куди ввійде."
LUK,22,11,"І скажіть господареві дому: Каже тобі учитель: Де сьвітлиця, щоб пасху з учениками моїми їсти?"
LUK,22,12,"І той вам покаже гірницю велику застелену; там приготовте."
LUK,22,15,"Бажаннєм забажав я сю пасху їсти з вами, перш ніж прийму муки:"
LUK,22,16,"глаголю бо вам: Що більш не їсти му її, доки сповнить ся в царстві Божому."
LUK,22,17,"Прийміть се та поділить собі:"
LUK,22,18,"глаголю бо вам: Що не пити му вже від плоду винограднього, доки царство Боже прийде."
LUK,22,19,"Се єсть тіло моє, що за вас даєть ся. Се чиніть на мій спомин."
LUK,22,20,"Ся чаша новий завіт у крові моїй, що за вас пролита буде."
LUK,22,21,"Та ось рука зрадника мого зо мною на столі."
LUK,22,22,"Син то чоловічий іде, як постановлено наперед, тільки ж горе чоловікові тому, що зрадить Його!"
LUK,22,25,"Царі в поган панують над ними, й ті, що власть над ними мають, добродіями звуть ся."
LUK,22,26,"Ви ж не так: тільки ж найбільший між вами нехай буде як найменший, і хто старший — як слуга."
LUK,22,27,"Хто бо більший: хто за столом, чи хто послугує? хиба не хто за столом? я ж між вами, як слуга."
LUK,22,28,"Ви ж пробували зо мною в спокусах моїх."
LUK,22,29,"І я завітую вам, як завітував мені Отець мій, царство,"
LUK,22,30,"щоб їли й пили за столом моїм у царстві моєму, і сиділи на престолах, судячи дванайцять родів Ізраїлевих."
LUK,22,31,"Симоне, Симоне, ось сатана жадав собі вас, щоб просівати, як пшеницю;"
LUK,22,32,"я ж молив ся за тебе, щоб не поменшала віра твоя, і ти колись, навернувшись, утверди братів твоїх."
LUK,22,34,"Глаголю тобі, Петре, не запіє сьогодні півень, перш ніж тричі відречеш ся, що не знаєш мене."
LUK,22,35,"Як посилав вас я без сакви, й торбини, й обувя, чи чого недоставало вам?"
LUK,22,36,"А тепер хто має сакву, нехай бере так само й торбину: а хто не має, нехай продасть одежу, та купить меч."
LUK,22,37,"Глаголю бо вам, що ще й се написане мусить справдитись на мені: І з беззаконними полічено його: бо все про мене сповняєть ся."
LUK,22,38,"Доволі."
LUK,22,40,"Моліть ся, щоб не ввійти в спокусу."
LUK,22,42,"Отче, коли хочеш, мимо неси чашу сю від мене: тільки ж не моя воля, а Твоя нехай буде."
LUK,22,46,"Чого спите? уставши моліть ся, щоб не ввійшли в спокусу."
LUK,22,48,"Юдо, цілуваннєм Сина чоловічого зраджуєш?"
LUK,22,51,"Оставте аж до сього."
LUK,22,52,"Як на розбійника ви прийшли з мечами та киями?"
LUK,22,53,"Як що-дня був я з вами в церкві, не простягали рук на мене; та се ваша година й власть темряви."
LUK,22,61,"Що перш ніж півень запіє, відречеш ся мене тричі."
LUK,22,67,"Коли вам скажу, не піймете віри;"
LUK,22,68,"коли ж і спитаю вас, не відповісте мені й не відпустите."
LUK,22,69,"Від нині сидіти ме Син чоловічий по правиці сили Божої."
LUK,22,70,"Ви кажете, що се я."
LUK,23,3,"Ти кажеш."
LUK,23,28,"Дочки Єрусалимські, не плачте по мені, а по собі плачте і по дітях ваших."
LUK,23,29,"Бо ось прийдуть дні, коли скажуть: Блаженні неплідні, й утроби, що не родили, й соски, що не годували."
LUK,23,30,"Тоді стануть говорити горам: Упадіть на нас, і узгіррям: Покрийте нас."
LUK,23,31,"Бо коли зеленому дереву се роблять, то з сухим що станеть ся?"
LUK,23,34,"Отче, відпусти їм; не знають бо, що роблять."
LUK,23,43,"Істино глаголю тобі: Сьогодні зо мною будеш у раю."
LUK,23,46,"Отче, у Твої руки передаю духа мого!"
LUK,24,7,"Що мусить Син чоловічий бути виданим у руки чоловіків грішників, і бути розпятим, і третього дня воскреснути."
LUK,24,17,"Що се за речі, про котрі розмовляєте між собою йдучи, та сумуєте?"
LUK,24,19,"Що ж таке?"
LUK,24,25,"о безумні і ліниві серцем вірувати всьому, що промовили пророки!"
LUK,24,26,"Чи не мусів се терпіти Христос і ввійти в славу свою?"
LUK,24,36,"Упокій вам."
LUK,24,38,"Чого стрівожились? і чого думки встають у серцях ваших?"
LUK,24,39,"Дивіть ся на руки мої і ноги мої, що се сам я. Дотикайтесь мене й вбачайте; бо дух тіла й костей не має, як бачите, що я маю."
LUK,24,41,"Маєте що їсти тут?"
LUK,24,44,"Оце ж слова, що глаголав я до вас, ще бувши з вами, що мусить справдити ся все, писане в законі Мойсейовому, й пророках, і псальмах про мене."
LUK,24,46,"Що так написано й так треба було терпіти Христу й воскреснути з мертвих третього дня;"
LUK,24,47,"і проповідуватись в імя Його покаянню і відпущенню гріхів між усіма народами, почавши від Єрусалиму."
LUK,24,48,"Ви ж сьвідки сього."
LUK,24,49,"І ось я посилаю обітуваннє Отця мого на вас; ви ж сидіть у городі Єрусалимі, поки одягнетесь силою звиш."
JHN,1,38,"Чого шукаєте?"
JHN,1,39,"Ідіть і подивіть ся."
JHN,1,42,"Ти єси Симон, син Йони; ти назвеш ся Кифа"
JHN,1,43,"Йди слідом за мною."
JHN,1,47,"Ось справді Ізраїлитянин, що в йому підступу нема."
JHN,1,48,"Перш ніж Филип покликав тебе, як був єси під смоківницею, бачив я тебе."
JHN,1,50,"Що сказав тобі: Я бачив тебе під смоківницею, то й віруєш? Більше сього бачити меш."
JHN,1,51,"Істино, істино глаголю вам: Від нині бачити мете небо відкрите, а ангелів Божих, що сходять угору і вниз на Сина чоловічого."
JHN,2,4,"Що мені й тобі, жено? ще не прийшла година моя."
JHN,2,7,"Поналивайте водники водою."
JHN,2,8,"Черпайте тепер, та й несіть до старости."
JHN,2,16,"Візьміть се звідсіля; не робіть дому Отця мого домом торговим."
JHN,2,19,"Зруйнуйте сю церкву, й я за три дні підніму вам її."
JHN,3,3,"Істино, істино глаголю тобі: Коли хто не народить ся звиш, не може видіти царства Божого."
JHN,3,5,"Істино, істино глаголю тобі: Коли хто не родить ся від води й Духа, не може ввійти в царство Боже."
JHN,3,6,"Роджене від тіла — тіло, а роджене від Духа — дух."
JHN,3,7,"Не дивуй ся, що глаголав тобі: Мусите ви народити ся звиш."
JHN,3,8,"Дух, де хоче, дише, й голос його чуєш, та не знаєш, звідкіля виходить, і куди йде; так усякий народжений від Духа."
JHN,3,10,"Ти єси учитель Ізраїлів, і сього не знаєш?"
JHN,3,11,"Істино, істино глаголю тобі: Що те, що знаємо, говоримо, й що бачили, сьвідкуємо; а сьвідкування нашого не приймаєте."
JHN,3,12,"Коли про земне глаголав вам, і не віруєте, — як же, коли скажу вам про небесне, увіруєте?"
JHN,3,13,"І ніхто не зійшов на небо, тільки хто з неба зійшов, Син чоловічий, що на небі."
JHN,3,14,"І, як Мойсей підняв угору гадюку в пустині, так мусить бути піднятий і Син чоловічий,"
JHN,3,15,"щоб кожний віруючий в Него не погиб, а мав життє вічнє."
JHN,3,16,"Так бо полюбив Бог сьвіт, що Сина свого єдинородного дав, щоб кожен, віруючий в Него, не погиб, а мав життє вічнє."
JHN,3,17,"Бо не післав Бог Сина свого на сьвіт, щоб осудив сьвіт, а щоб спас ся Ним сьвіт."
JHN,3,18,"Хто вірує в Него, не осудить ся; хто ж не вірує, уже осуджений; бо не вірував у ймя єдинородного Сина Божого."
JHN,3,19,"Сей же єсть суд, що сьвітло прийшло на сьвіт, а полюбили люде темряву більше ніж сьвітло; були бо лихі їх учинки."
JHN,3,20,"Кожен бо, хто чинить лихе, ненавидить сьвітло, й не йде до сьвітла, щоб не зганено вчинків його."
JHN,3,21,"Хто ж робить правду, йде до сьвітла, щоб виявились його вчинки, бо в Бозї роблені."
JHN,4,7,"Дай мені пити."
JHN,4,10,"Коли б знала дар Божий і хто се говорить тобі: Дай мені пити, ти просила б Його, й дав би тобі води живої."
JHN,4,13,"Всякий, хто пє воду сю забажає знов;"
JHN,4,14,"хто ж напєть ся води, що я дам йому, не забажає до віку; а вода, що дам йому, буде в йому жерелом води, що тече в життє вічнє."
JHN,4,16,"Іди поклич чоловіка твого, та й приходь сюди."
JHN,4,17,"Добре сказала єси, що чоловіка не маєш;"
JHN,4,18,"пять бо чоловіків мала, та й тепер которого маєш, не чоловік тобі; у сьому правду сказала єси."
JHN,4,21,"Жінко, вір мені, що прийде час, коли ні на горі сій, ані в Єрусалимі покланяти метесь ви Отцеві."
JHN,4,22,"Ви кланяєтесь, а чому — не знаєте; ми кланяємось, і чому — знаємо, бо спасеннє від Жидів."
JHN,4,23,"Та прийде час, і вже єсть, що правдиві поклонники поклонять ся Отцеві духом і правдою; Отець бо таких шукає покланяючих ся Йому."
JHN,4,24,"Дух — Бог, і хто покланяєть ся Йому, духом і правдою мусить покланятись."
JHN,4,26,"Се я, що глаголю тобі."
JHN,4,32,"Я маю їжу їсти, котрої ви не знаєте."
JHN,4,34,"Моя їжа, щоб чинити волю Пославшого мене, й скінчити Його діло."
JHN,4,35,"Хиба ви не кажете: Що ще чотирі місяці, та й жнива прийдуть? Ось глаголю вам: Здійміть очі ваші, та погляньте на ниви, що вже пополовіли на жнива."
JHN,4,36,"І приймає жнець плату, й збирає овощ у життє вічнє, щоб і хто сіє радував ся, і хто жне."
JHN,4,37,"Бо у сьому слово правдиве: що инший, хто сіє, а инший, хто жне."
JHN,4,38,"Я післав вас жати, коло чого ви не працювали; инші люде працювали, а ви на працю їх увійшли."
JHN,4,48,"Коли ознак та див не побачите, не увіруєте."
JHN,4,50,"Іди, син твій живий."
JHN,4,53,"Що син твій живий;"
JHN,5,6,"Хочеш одужати?"
JHN,5,8,"Устань, візьми постіль твою, та й ходи!"
JHN,5,11,"Візьми постіль твою, та й ходи."
JHN,5,12,"Візьми постіль твою, та й ходи?"
JHN,5,14,"Оце одужав єси; не гріши більш, щоб гіршого тобі не стало ся."
JHN,5,17,"Отець мій і досі робить і я роблю."
JHN,5,19,"Істино, істино глаголю вам: Не може Син нічого робити від себе, коли не бачить, що Отець те робить: що бо Той робить, те й Син так само робить."
JHN,5,20,"Отець бо любить Сина, і все показує Йому, що сам робить; і більші сих покаже Йому діла, щоб ви дивувались."
JHN,5,21,"Бо, як Отець воскрешає мертвих і оживлює, так і Син, кого хоче, оживлює."
JHN,5,22,"Бо Отець і не судить нікого, а суд увесь дав Синові,"
JHN,5,23,"щоб усі шанували Сина, як шанують Отця. Хто не шанує Сина, не шанує Отця, що післав Його."
JHN,5,24,"Істино, істино глаголю вам: Що, хто слухає слово моє і вірує Пославшому мене, має життє вічнє, і на суд не прийде, а перейде від смерти в життє."
JHN,5,25,"Істино, істино глаголю вам: Що прийде час, і нині єсть, що мертві почують голос Сина Божого, й почувши оживуть."
JHN,5,26,"Бо, як Отець має життє в собі, так дав і Синові життє мати в собі,"
JHN,5,27,"і власть дав Йому і суд чинити; бо Він Син чоловічий."
JHN,5,28,"Не дивуйтесь сьому, бо прийде час, що в гробах почують голос Його,"
JHN,5,29,"і повиходять: которі добро робили, в воскресеннє життя, а которі зло робили, в воскресеннє суду."
JHN,5,30,"Не можу я робити від себе нічого: як чую, суджу; і суд мій праведний; бо не шукаю волі моєї, а волі пославшого мене Отця."
JHN,5,31,"Коли я сьвідкую про себе, сьвідченнє моє не правдиве."
JHN,5,32,"Инший єсть, хто сьвідкує про мене; і я знаю, що правдиве сьвідченнє, котре про мене сьвідкує."
JHN,5,33,"Ви посилали до Йоана, й сьвідкував правді."
JHN,5,34,"Я же не від чоловіка сьвідченнє приймаю, а глаголю се, щоб ви спаслись."
JHN,5,35,"Той був сьвітильник горючий і сьвітючий; ви ж хотіли повеселитись на часину сьвітлом його."
JHN,5,36,"Я ж маю сьвідченнє більше Йоанового: діла бо, що дав мені Отець, щоб їх скінчити, ті діла, що я роблю, сьвідкують про мене, що Отець мене післав."
JHN,5,37,"І пославший мене Отець сам сьвідкував про мене. Ані голосу Його не чули ви ніколи, ані виду Його не бачили;"
JHN,5,38,"і слова Його не маєте пробуваючого в вас; бо кого післав Він, тому ви не віруєте."
JHN,5,39,"Прослідіть писання; бо ви думаєте в них життє вічнє мати; й ті сьвідкують про мене."
JHN,5,40,"Та не хочете прийти до мене, щоб життє мати."
JHN,5,41,"Чести від людей не приймаю."
JHN,5,42,"Та я спізнав вас, що любови Божої не маєте в собі."
JHN,5,43,"Я прийшов в імя Отця мого, і не приймаєте мене. Коли инший прийде в імя своє, того приймете."
JHN,5,44,"Як ви можете вірувати, славу один від одного приймаючи, а слави, що від одного Бога, не шукаєте?"
JHN,5,45,"Не думайте, що я обвинувачу вас перед Отцем: є хто винуватить вас: Мойсей, що на него вповаєте."
JHN,5,46,"Коли б ви вірували Мойсейові, вірували б мені; бо про мене той писав."
JHN,5,47,"Коли ж його писанням не віруєте, як моїм словам вірувати мете?"
